user,assistant
Pablo Vegetti,"Pablo Vegetti é um atacante dedicado e consistente, com contribuição regular em situações de jogo.
Ele se destaca de maneira impressionante no jogo aéreo, sendo muito acima da média, e possui uma boa finalização, o que o torna uma ameaça em cruzamentos e situações de gol.
Seus números em oportunismo são sólidos, mas sua contribuição em criação para os companheiros e transição ofensiva é apenas mediana, o que reflete um perfil mais estático e finalizador.
Ele apresenta fraquezas em pressão na linha alta e conexão ofensiva, indicando que sua atuação fora da área e na recuperação de posse é limitada.
Comparado a outros atacantes, Vegetti é um especialista em bolas aéreas e finalização, mas com limitações evidentes em dinamicidade e impacto defensivo."
Pedro,"Pedro é um atacante técnico e eficiente, com forte presença em situações de finalização e decisão no ataque.
Ele se destaca de forma excepcional no oportunismo, sendo muito acima da média, e apresenta uma finalização confiável, consolidando-se como uma referência na área adversária.
Sua transição ofensiva e criação para companheiros é mediana, indicando equilíbrio em sua contribuição dinâmica e coletiva.
Por outro lado, ele demonstra fraquezas em pressão na linha alta, conexão ofensiva e ameaças em jogadas aéreas, o que limita sua atuação em aspectos físicos e defensivos.
Comparado a outros atacantes, Pedro é um finalizador nato com excelente leitura de jogo, mas carece de dinamismo fora da área e impacto físico."
Yannick Bolasie,"Yannick Bolasie é um atacante dinâmico e criativo, com boa participação nas ações ofensivas e habilidade para envolver os companheiros no jogo.
Ele se destaca em transição ofensiva e criação para os companheiros, sendo acima da média nesses aspectos, o que evidencia sua capacidade de movimentação e visão de jogo.
Em oportunismo e finalização, Bolasie apresenta desempenho mediano, contribuindo de maneira consistente, mas sem ser excepcional em situações de gol.
Contudo, ele tem fraquezas em pressão na linha alta e ameaça aérea, o que pode limitar sua presença em aspectos físicos e defensivos do jogo.
Comparado a outros atacantes, Bolasie é um jogador técnico e criativo, com um bom impacto em jogadas dinâmicas, mas com margem de melhoria em situações decisivas e intensidade defensiva."
Rafael Borré,"Rafael Borré é um atacante eficiente e com boa presença em campo, contribuindo de maneira relevante para o setor ofensivo do time.
Ele se destaca de forma excepcional no oportunismo, mostrando excelente habilidade para estar no lugar certo e capitalizar oportunidades de gol.
Seus números em transição ofensiva, conexão ofensiva e finalização são equilibrados, colocando-o na média em aspectos técnicos e físicos.
No entanto, ele apresenta desempenho modesto em criação para companheiros e ameaça aérea, o que limita sua contribuição como um atacante multifuncional.
Comparado a outros atacantes, Borré é uma figura consistente e letal em situações de gol, mas com margem para melhorar em criatividade e presença física. "
