user,assistant
"Mateus Carvalho, 2024","Mateus Carvalho é um volante com características defensivas equilibradas e uma contribuição moderada em aspectos de construção de jogo. Ele se destaca em defesa ativa e inteligência defensiva, mostrando boa capacidade para recuperar a posse de bola e manter a estrutura defensiva. Seu desempenho em progressão está na média, contribuindo de forma razoável para transições ofensivas, mas sem ser um elemento de destaque. No entanto, ele apresenta fraquezas em qualidade de passe e criação para companheiros, limitando seu impacto em jogadas ofensivas e na construção criativa. Comparado a outros primeiros volantes, Mateus Carvalho é sólido defensivamente, mas precisa melhorar sua contribuição técnica para ser mais efetivo em todas as fases do jogo. "
"Gregore, 2024","Gregore é um volante altamente eficiente, com grande impacto nas ações defensivas e excelente contribuição para a estrutura tática da equipe. Ele se destaca de forma excepcional em defesa ativa e inteligência defensiva, estando muito acima da média, além de ter boa capacidade de progressão com a bola. Sua qualidade de passe é sólida, contribuindo de forma razoável para manter a posse e iniciar transições, embora não seja um destaque na criação para companheiros. Ele apresenta uma pequena limitação em jogadas criativas, o que pode restringir seu papel em ações ofensivas mais elaboradas.
Comparado a outros primeiros volantes, Gregore é um dos mais eficazes defensivamente, combinando intensidade e leitura de jogo, com habilidades técnicas suficientes para apoiar o ataque em transições rápidas."
"Marlon Freitas, 2024","Marlon Freitas é um volante com excelente capacidade técnica e foco em construção ofensiva, se destacando no apoio ao ataque. Ele é excepcional em progressão e qualidade de passe, além de ter um desempenho acima da média na criação para companheiros, mostrando-se uma peça-chave na transição e organização do jogo. Contudo, seus números em defesa ativa e inteligência defensiva estão abaixo da média, indicando limitações em aspectos mais defensivos de sua posição. Seu impacto é maior na fase ofensiva do jogo, mas ele carece de solidez e intensidade em recuperação de posse e controle de espaço. Comparado a outros primeiros volantes, Marlon Freitas é uma opção diferenciada com perfil técnico e ofensivo, ideal para sistemas que priorizem posse e progressão, mas menos eficaz em situações defensivas. ​"
"Hércules, 2024","Hércules é um volante com desempenho limitado em várias áreas, sendo mais focado em contribuir de forma pontual para a equipe. Ele apresenta um desempenho mediano em criação para companheiros, mostrando alguma capacidade de ajudar em jogadas ofensivas quando necessário. Contudo, ele está abaixo da média em defesa ativa, inteligência defensiva, progressão com a bola e qualidade de passe, indicando dificuldades tanto em aspectos defensivos quanto na construção de jogo. Sua participação geral no jogo é reduzida, o que pode indicar uma presença menos impactante durante a partida. Comparado a outros primeiros volantes, Hércules precisa melhorar significativamente em aspectos defensivos e técnicos para ter maior impacto em sua posição e na dinâmica do time. ​"
